{
  "$schema": "../../schema/case-manifest.schema.json",
  "schema_version": "runparity.fixture-case/v1",
  "case_id": "DEV-NATIVE-002",
  "suite": "open-development-v1",
  "kind": "supported_positive",
  "title": "Native artifact targets the wrong CPU architecture",
  "summary": "A pre-existing AArch64 native addon layer has an ELF machine header different from the fixed Linux x64/glibc runtime, while a same-source x64 layer remains content-addressed for the intervention arm.",
  "fixture_status": "implemented",
  "gold_category": "NATIVE_ABI_ARCH_MISMATCH",
  "expected_terminal_verdict": "VERIFIED_INTERVENTION",
  "platform": {
    "os": "linux",
    "arch": "x64",
    "libc": "glibc",
    "execution_context": "linux_isolated_experiment"
  },
  "proof_eligibility": {
    "eligible": true,
    "backend": "linux_rootless_oci",
    "reason": "The planned case changes one typed dimension inside the supported Linux isolation backend."
  },
  "oracle": {
    "type": "exit_code_and_stdout",
    "description": "The unchanged fixture assertion exits zero and emits the DEV-NATIVE-002 success marker.",
    "frozen_across_arms": true,
    "success": {
      "exit_code": 0,
      "stdout_contains": "RUNPARITY_OK:dev-native-002",
      "stderr_contains": null,
      "artifact_path": null
    }
  },
  "allowed_typed_intervention": {
    "type": "nativeArtifact.select",
    "target": "fixture_native_addon",
    "parameters": {
      "artifact_role": "matching_cpu_arch",
      "content_addressed_only": true
    }
  },
  "expected_refusal": null,
  "source_evidence_ids": ["SRC-NODE-PROCESS-ABI", "SRC-RUNPARITY-V1-SCOPE"],
  "scenario": {
    "failure_mode": "The loader hash-validates the selected addon, parses its ELF64 little-endian e_machine field as AArch64, and rejects it before require because that checked artifact does not match the fixed x64 runtime. A separate Host smoke records Node's real but generic cross-architecture dlopen failure without interpreting its text as an architecture proof.",
    "planned_setup": [
      "Provide x64 and AArch64 content-addressed Linux addon layers compiled from the same source and Node 22 ABI headers.",
      "Keep the Node ABI, source revision, compiler language level, loader assertion, and dependencies fixed.",
      "Select the AArch64 layer in A1 and A2; select the x64 layer only in B.",
      "Treat the binary ELF header as the architecture evidence and the direct Node loading failure only as a separate execution smoke."
    ],
    "planned_target_argv": ["node", "fixture/load-native-addon.mjs"],
    "expected_a_failure_signature": "RP_FIXTURE_NATIVE_ARCH_MISMATCH"
  },
  "safety_expectations": {
    "network": "disabled",
    "host_writes": "fixture_workspace_only",
    "sensitive_flag_probe": false,
    "unicode_control_probe": false,
    "timeout_cleanup_probe": false,
    "hmac_digest_probe": true,
    "recognized_shim_probe": false
  },
  "implementation": {
    "runnable": true,
    "asset_root": "development/assets/DEV-NATIVE-002",
    "missing_assets": [],
    "receipts": {
      "build": "receipts/build/DEV-NATIVE-002.json",
      "backend_qualification": null,
      "verification_ledger": null
    },
    "verified_at": null
  }
}
